{
  "evidence_schema_version": "1.0.0",
  "contract_id": "audiencelab.android.native.integration",
  "contract_version": "1.0.0",
  "package_sdk_version": "1.1.11",
  "generated_at": "2026-09-06T12:00:00Z",
  "environment": "sandbox",
  "app": {
    "application_id": "com.example.demo",
    "app_version": "1.0.0",
    "min_sdk": 24,
    "target_sdk": 36
  },
  "local": {
    "resolved_maven_coordinate": "ai.audiencelab:audiencelab-android-sdk:1.1.11",
    "sdk_version_runtime": "1.1.11",
    "manifest_permissions": [
      "android.permission.INTERNET"
    ],
    "secret_storage_mechanism": "ci_secret_to_buildconfig",
    "vcs_secret_scan_passed": true,
    "install_method": "gradle_github_packages"
  },
  "runtime": {
    "initialize_returned_true": true,
    "is_initialized": true,
    "token": {
      "has_valid_token": true,
      "last_fetch_status": "success",
      "creative_token_preview": "ct_****abcd",
      "attempt_count": 1
    },
    "signals_emitted": [
      {
        "id": "custom",
        "accepted_locally": true,
        "queue_size_after": 0
      }
    ],
    "runtime_errors": [],
    "identity_settled": true,
    "api_key_preview": "ak_****wxyz"
  },
  "backend": {
    "environment": "sandbox",
    "accepted_signal_count": 1,
    "freshness_ok": true,
    "blocking_failures": [],
    "readiness_state": "signal_received",
    "observation_source": "audiencelab-mcp-or-backend-health"
  },
  "secrets": {
    "raw_api_key_present": false,
    "raw_creative_token_present": false
  },
  "checks": {
    "package_version_pinned": {
      "passed": true,
      "detail": "Maven coordinate and runtime SDK version both 1.1.11"
    },
    "manifest_internet_present": {
      "passed": true,
      "detail": "INTERNET permission present"
    },
    "secret_not_in_vcs": {
      "passed": true,
      "detail": "API key injected from CI secret"
    },
    "initialize_succeeded": {
      "passed": true
    },
    "creative_token_obtained": {
      "passed": true
    },
    "signal_emitted_without_runtime_error": {
      "passed": true
    },
    "accepted_signal_observed": {
      "passed": true,
      "detail": "Sandbox accepted signal observed; sandbox does not imply analysis-ready"
    },
    "no_blocking_validation_failures": {
      "passed": true
    }
  },
  "result": "pass",
  "notes": [
    "Example only. Replace with real host-app evidence.",
    "Sandbox evidence can certify integration mechanics; analysis-ready requires production (or approved prod-like) credentials and accepted production signals per GEE-481."
  ]
}
